DUF2996 domain-containing protein				P9301_RS13990		WP_011862988.1	WP_011862988.1		PF11210
DUF1651 domain-containing protein		integral component of membrane // membrane		P9301_RS15080		WP_041484768.1	WP_041484768.1		PF07864
GDP-L-fucose synthase	'de novo' GDP-L-fucose biosynthetic process // nucleotide-sugar biosynthetic process // metabolic process		NADP+ binding // GDP-L-fucose synthase activity // isomerase activity // oxidoreductase activity // catalytic activity	fcl	GDP-L-fucose biosynthesis I (from GDP-D-mannose)	WP_041484777.1	WP_041484777.1		PF01370
pyridoxine 5'-phosphate synthase				P9301_RS14875	pyridoxal 5'-phosphate biosynthesis I	WP_041484703.1	WP_041484703.1		PF03740
YggS family pyridoxal phosphate-dependent enzyme			pyridoxal phosphate binding	P9301_RS11100		WP_011862419.1	WP_011862419.1		PF01168
hypothetical protein				P9301_RS16310		WP_011863444.1	WP_011863444.1		
Phenylalanyl-tRNA synthetase beta subunit	phenylalanyl-tRNA aminoacylation // translation	cytoplasm	metal ion binding // ligase activity // ATP binding // phenylalanine-tRNA ligase activity // aminoacyl-tRNA ligase activity // RNA binding // magnesium ion binding // nucleotide binding // tRNA binding	pheT		WP_011862958.1	WP_011862958.1		PF01588
<em>sn</em>-1 stearoyl-lipid 9-desaturase				desC	oleate biosynthesis III (cyanobacteria)	WP_011863767.1	WP_011863767.1		PF00487
DUF2949 domain-containing protein				P9301_RS14040		WP_011862999.1	WP_011862999.1		PF11165
methyltransferase domain-containing protein			transferase activity	P9301_RS13585		WP_011862909.1	WP_011862909.1		PF13649
sulfite exporter TauE/SafE family protein		integral component of membrane // membrane // plasma membrane		P9301_RS14150		WP_011863021.1	WP_011863021.1		PF01925
formyltetrahydrofolate deformylase	biosynthetic process // one-carbon metabolic process // 'de novo' IMP biosynthetic process // purine nucleotide biosynthetic process		"hydrolase activity // hydroxymethyl-, formyl- and related transferase activity // formyltetrahydrofolate deformylase activity"	purU	formaldehyde oxidation VII (THF pathway)	WP_011863797.1	WP_011863797.1		PF00551
ATP synthase chain a				atpB		WP_011863567.1	WP_011863567.1		PF00119
hypothetical protein				P9301_RS15680		WP_011863328.1	WP_011863328.1		
SLC13 family permease	cation transmembrane transport // transmembrane transport // potassium ion transport	integral component of membrane // membrane	cation transmembrane transporter activity	P9301_RS09560		WP_011862123.1	WP_011862123.1		PF03600
ABC transporter permease	transmembrane transport	ATP-binding cassette (ABC) transporter complex // integral component of membrane // membrane // plasma membrane		P9301_RS11385		WP_011862472.1	WP_011862472.1		PF01061
glutathione-disulfide reductase	cellular oxidant detoxification // cell redox homeostasis		"flavin adenine dinucleotide binding // oxidoreductase activity, acting on a sulfur group of donors, NAD(P) as acceptor // oxidoreductase activity // glutathione-disulfide reductase (NADPH) activity // nucleotide binding"	gorA	glutathione-peroxide redox reactions	WP_011862583.1	WP_011862583.1		PF07992
30S ribosomal protein S4	translation	small ribosomal subunit // ribosome	rRNA binding // structural constituent of ribosome // RNA binding	rpsD		WP_011817920.1	WP_011817920.1		PF00163
TIGR01548 family HAD-type hydrolase			lyase activity // imidazoleglycerol-phosphate dehydratase activity	P9301_RS17200		WP_011863634.1	WP_011863634.1		
hypothetical protein		integral component of membrane // membrane		P9301_RS16535		WP_011863492.1	WP_011863492.1		
tRNA epoxyqueuosine(34) reductase QueG	queuosine biosynthetic process // tRNA processing		iron-sulfur cluster binding // oxidoreductase activity	queG	queuosine biosynthesis I (<i>de novo</i>)	WP_011862034.1	WP_011862034.1		PF08331
nucleoside triphosphate pyrophosphohydrolase				mazG	pyrimidine deoxyribonucleotides dephosphorylation // pyrimidine deoxyribonucleotides <i>de novo</i> biosynthesis III	WP_011863780.1	WP_011863780.1		PF03819
CYTH domain-containing protein				P9301_RS09940		WP_011862200.1	WP_011862200.1		
orotate phosphoribosyltransferase	'de novo' UMP biosynthetic process // nucleoside metabolic process // pyrimidine nucleotide biosynthetic process		"transferase activity, transferring glycosyl groups // transferase activity // orotate phosphoribosyltransferase activity // magnesium ion binding"	pyrE	superpathway of pyrimidine ribonucleotides <i>de novo</i> biosynthesis // UMP biosynthesis I	WP_011862315.1	WP_011862315.1		
hypothetical protein		integral component of membrane // membrane		P9301_RS10145		WP_011862241.1	WP_011862241.1		
Macrophage migration inhibitory factor family				P9301_RS15535		WP_011863301.1	WP_011863301.1		PF01187
hypothetical protein		integral component of membrane // membrane		P9301_RS11595		WP_041484664.1	WP_041484664.1		
septum site-determining protein MinC	regulation of cell septum assembly // cell septum assembly // regulation of cell cycle // cell division // cell cycle // division septum assembly // cell morphogenesis			minC		WP_011862358.1	WP_011862358.1		PF03775
high light inducible protein		integral component of membrane // membrane		P9301_RS15310		WP_011863258.1	WP_011863258.1		
threonine synthase	threonine biosynthetic process // cellular amino acid biosynthetic process // cellular amino acid metabolic process		pyridoxal phosphate binding // lyase activity // threonine synthase activity	thrC	L-threonine biosynthesis	WP_011863810.1	WP_011863810.1		PF00291
zinc ABC transporter solute-binding protein	metal ion transport		metal ion binding	P9301_RS14490		WP_011863093.1	WP_011863093.1		PF01297
chromate efflux transporter	chromate transport	integral component of membrane // membrane	chromate transmembrane transporter activity	chrA		WP_011863187.1	WP_011863187.1		PF02417
glycosyltransferase family 4 protein		integral component of membrane // membrane	transferase activity // phospho-N-acetylmuramoyl-pentapeptide-transferase activity	P9301_RS15845		WP_041484716.1	WP_041484716.1		PF00953
ABC transporter ATP-binding protein	transmembrane transport	integral component of membrane // membrane	ATPase-coupled transmembrane transporter activity // ATPase // ATP binding // nucleotide binding	P9301_RS14835		WP_011863157.1	WP_011863157.1		PF00664
site-specific integrase	DNA integration // DNA recombination		DNA binding	P9301_RS11770		WP_011862543.1	WP_011862543.1		PF00589
preprotein translocase subunit SecA	intracellular protein transmembrane transport // protein import // protein transport // intracellular protein transport // protein targeting	thylakoid membrane // membrane // thylakoid // plasma membrane // cytoplasm	ATP binding // nucleotide binding	secA		WP_041484785.1	WP_041484785.1		PF07517
NAD/NADP transhydrogenase alpha subunit				pntA		WP_011863273.1	WP_011863273.1		PF12769
D-Ala-D-Ala dipeptidase	cell wall organization // proteolysis		metal ion binding // dipeptidase activity // hydrolase activity // zinc ion binding // metallopeptidase activity // peptidase activity	P9301_RS13015		WP_011862794.1	WP_011862794.1		PF01427
Possible Signal peptide binding domain-containing protein				P9301_RS09800		WP_011862172.1	WP_011862172.1		
DUF3303 domain-containing protein				P9301_RS14250		WP_011863043.1	WP_011863043.1		PF11746
hypothetical protein		integral component of membrane // membrane		P9301_RS14420		WP_011863076.1	WP_011863076.1		
hypothetical protein				P9301_RS13255		WP_041484681.1	WP_041484681.1		
Possible D12 class N6 adenine-specific DNA met				P9301_RS12770		WP_011862743.1	WP_011862743.1		
"1,4-alpha-glucan branching protein GlgB"	glycogen biosynthetic process // glycogen metabolic process // carbohydrate metabolic process		"1,4-alpha-glucan branching enzyme activity (using a glucosylated glycogenin as primer for glycogen synthesis) // cation binding // transferase activity, transferring glycosyl groups // transferase activity // hydrolase activity, hydrolyzing O-glycosyl compounds // 1,4-alpha-glucan branching enzyme activity // catalytic activity"	glgB	glycogen biosynthesis I (from ADP-D-Glucose)	WP_011862600.1	WP_011862600.1		PF02922
ATP synthase subunit I		integral component of membrane // membrane		atp1		WP_011863568.1	WP_011863568.1		PF12966
Possible Josephin				P9301_RS14180		WP_011863028.1	WP_011863028.1		
response regulator transcription factor	"regulation of transcription, DNA-templated // phosphorelay signal transduction system"		hydrolase activity // protein-glutamate methylesterase activity // DNA binding	P9301_RS15005		WP_011863192.1	WP_011863192.1		PF00072
DUF805 domain-containing protein		integral component of membrane // membrane		P9301_RS16540		WP_011863494.1	WP_011863494.1		PF05656
AbrB family transcriptional regulator	regulation of gene expression	integral component of membrane // membrane		P9301_RS09260		WP_011862060.1	WP_011862060.1		PF05145
DUF4278 domain-containing protein				P9301_RS18285		WP_011862700.1	WP_011862700.1		PF14105
alanine racemase	D-alanine biosynthetic process // alanine metabolic process		pyridoxal phosphate binding // isomerase activity // alanine racemase activity // catalytic activity	alr	alanine racemization	WP_011863635.1	WP_011863635.1		PF01168
IF2_N domain-containing protein				P9301_RS18465		WP_011863062.1	WP_011863062.1		PF04760
ATP-binding cassette domain-containing protein	transmembrane transport	integral component of membrane // membrane	ATPase-coupled transmembrane transporter activity // ATPase // ATP binding // nucleotide binding	P9301_RS09465		WP_011862104.1	WP_011862104.1		PF06472
30S ribosome-binding factor RbfA	ribosome biogenesis // maturation of SSU-rRNA // rRNA processing	cytoplasm		rbfA		WP_011862155.1	WP_011862155.1		PF02033
Protein family PM-11				P9301_RS15220		WP_011818721.1	WP_011818721.1		
7-cyano-7-deazaguanine synthase QueC	queuosine biosynthetic process		"metal ion binding // ligase activity, forming carbon-nitrogen bonds // ligase activity // zinc ion binding // ATP binding // nucleotide binding"	queC	preQ<sub>0</sub> biosynthesis	WP_011863787.1	WP_011863787.1		PF06508
RpoD/SigA family RNA polymerase sigma factor	"regulation of DNA-templated transcription, initiation // regulation of transcription, DNA-templated // DNA-templated transcription, initiation"		sigma factor activity // DNA-binding transcription factor activity // DNA binding	P9301_RS16080		WP_011863404.1	WP_011863404.1		PF00140
prepilin-type N-terminal cleavage/methylation domain-containing protein		integral component of membrane // membrane		P9301_RS12530		WP_011862690.1	WP_011862690.1		PF07963
cell division protein FtsW	cell division	integral component of membrane // membrane		P9301_RS16855		WP_011863569.1	WP_011863569.1		PF01098
O-antigen ligase family protein		integral component of membrane // membrane		P9301_RS15690		WP_011863329.1	WP_011863329.1		PF04932
high light inducible protein		integral component of membrane // membrane		P9301_RS15315		WP_011863259.1	WP_011863259.1		PF00504
FAD-binding protein			FAD binding // flavin adenine dinucleotide binding // oxidoreductase activity // catalytic activity	P9301_RS16155		WP_144038832.1	WP_144038832.1		PF01565
glutamate--cysteine ligase	cellular modified amino acid biosynthetic process		ligase activity // ATP binding // glutamate-cysteine ligase activity // catalytic activity // nucleotide binding	gshA	ophthalmate biosynthesis // glutathione biosynthesis	WP_011863678.1	WP_011863678.1		PF04107
"Trk-type K+ transport system, membrane component"	cation transmembrane transport // transmembrane transport // cation transport	integral component of membrane // membrane	cation transmembrane transporter activity	trkG		WP_011862124.1	WP_011862124.1		PF02386
hypothetical protein		integral component of membrane // membrane		P9301_RS15155		WP_011863230.1	WP_011863230.1		
ATP-binding cassette domain-containing protein			ATPase // ATP binding // nucleotide binding	P9301_RS14125		WP_011863015.1	WP_011863015.1		PF00005
FAD-binding protein			oxidoreductase activity	P9301_RS15105		WP_011863214.1	WP_011863214.1		PF00890
iron-containing alcohol dehydrogenase family protein			"metal ion binding // oxidoreductase activity, acting on CH-OH group of donors // oxidoreductase activity // glycerol dehydrogenase [NAD+] activity"	P9301_RS14775		WP_011863145.1	WP_011863145.1		PF00465
iron ABC transporter permease	transmembrane transport	integral component of membrane // membrane // plasma membrane		P9301_RS11600		WP_041484665.1	WP_041484665.1		PF00528
hypothetical protein				P9301_RS10935		WP_011862381.1	WP_011862381.1		
leucyl aminopeptidase	protein metabolic process // proteolysis	cytoplasm	metal ion binding // manganese ion binding // hydrolase activity // metalloexopeptidase activity // peptidase activity // aminopeptidase activity	P9301_RS16315		WP_011863445.1	WP_011863445.1		PF02789
chaperonin GroEL	protein refolding // protein folding	cytoplasm	unfolded protein binding // ATP binding // nucleotide binding	groL		WP_011862474.1	WP_011862474.1		PF00118
Possible Type I restriction modification DNA s				P9301_RS16545		WP_011863495.1	WP_011863495.1		
Possible Hantavirus glycoprotein G2		integral component of membrane // membrane		P9301_RS12275		WP_011862640.1	WP_011862640.1		
NAD(+) kinase	NAD metabolic process // phosphorylation // NADP biosynthetic process	cytoplasm	metal ion binding // transferase activity // kinase activity // ATP binding // NAD+ kinase activity // nucleotide binding	P9301_RS09945	NAD phosphorylation and transhydrogenation	WP_011862201.1	WP_011862201.1		PF01513
urea ABC transporter ATP-binding subunit UrtE			ATPase // hydrolase activity // ATP binding // nucleotide binding	urtE		WP_011862854.1	WP_011862854.1		PF00005
alpha/beta fold hydrolase			"hydrolase activity // transferase activity, transferring acyl groups // transferase activity"	P9301_RS17580		WP_011863702.1	WP_011863702.1		PF12697
membrane protein insertion efficiency factor YidD		membrane // plasma membrane		yidD		WP_011862433.1	WP_011862433.1		PF01809
30S ribosomal protein S15	translation	ribosome	rRNA binding // structural constituent of ribosome // RNA binding	rpsO		WP_011862886.1	WP_011862886.1		PF00312
hypothetical protein				P9301_RS09265		WP_011862061.1	WP_011862061.1		
Cysteine synthase				cysK1	L-cysteine biosynthesis I	WP_011862166.1	WP_011862166.1		PF00291
acyl carrier protein									
pentapeptide repeat-containing protein				P9301_RS12400		WP_011862665.1	WP_011862665.1		PF13599
branched-chain amino acid transaminase	valine biosynthetic process // leucine biosynthetic process // isoleucine biosynthetic process // branched-chain amino acid biosynthetic process // branched-chain amino acid metabolic process // cellular amino acid biosynthetic process		L-isoleucine transaminase activity // L-valine transaminase activity // L-leucine transaminase activity // transferase activity // transaminase activity // branched-chain-amino-acid transaminase activity // catalytic activity	P9301_RS13805	L-isoleucine biosynthesis I (from threonine) // L-valine biosynthesis // superpathway of branched chain amino acid biosynthesis // L-leucine biosynthesis	WP_011862951.1	WP_011862951.1		PF01063
hypothetical protein		integral component of membrane // membrane		P9301_RS17695		WP_041484784.1	WP_041484784.1		
response regulator transcription factor	"regulation of transcription, DNA-templated // phosphorelay signal transduction system"		hydrolase activity // protein-glutamate methylesterase activity // DNA binding	P9301_RS09805		WP_011862173.1	WP_011862173.1		PF00072
polysaccharide biosynthesis protein		integral component of membrane // membrane		P9301_RS15850		WP_011863360.1	WP_011863360.1		PF02719
cytochrome C biogenesis protein CcdA	cytochrome complex assembly	integral component of membrane // membrane		P9301_RS16860		WP_011863570.1	WP_011863570.1		PF02683
Re/Si-specific NAD(P)(+) transhydrogenase subunit alpha			oxidoreductase activity // NAD(P)+ transhydrogenase (AB-specific) activity	P9301_RS15390		WP_011863274.1	WP_011863274.1		PF05222
Probable N-acyl-L-amino acid amidohydrolase			hydrolase activity	P9301_RS17660		WP_011863713.1	WP_011863713.1		PF01546
homoserine kinase	phosphorylation // threonine biosynthetic process // cellular amino acid biosynthetic process // threonine metabolic process	cytoplasm	transferase activity // kinase activity // ATP binding // homoserine kinase activity // nucleotide binding	thrB	L-threonine biosynthesis // L-methionine biosynthesis II (plants)	WP_011862611.1	WP_011862611.1		PF00288
phosphoribosyltransferase	nucleoside metabolic process		transferase activity	P9301_RS14190		WP_011863030.1	WP_011863030.1		
cytochrome b6-f complex subunit PetN	electron transport chain // cytochrome complex assembly // photosynthesis	thylakoid membrane // integral component of membrane // membrane // thylakoid // cytochrome b6f complex	"electron transporter, transferring electrons within cytochrome b6/f complex of photosystem II activity // electron transfer activity"	petN	oxygenic photosynthesis // photosynthesis light reactions	WP_011376303.1	WP_011376303.1		PF03742
phycobilisome protein	photosynthesis	phycobilisome		cpeB		WP_011862342.1	WP_011862342.1		PF00502
NAD-dependent epimerase/dehydratase family protein			UDPsulfoquinovose synthase activity // hydrolase activity // catalytic activity	P9301_RS17920		WP_011863760.1	WP_011863760.1		PF01370
pyruvate kinase	phosphorylation // glycolytic process		potassium ion binding // transferase activity // kinase activity // pyruvate kinase activity // catalytic activity // magnesium ion binding	pyk	Rubisco shunt // glycolysis III (from glucose) // Entner-Doudoroff pathway I	WP_011862918.1	WP_011862918.1		PF00224
ferrochelatase	heme biosynthetic process // porphyrin-containing compound biosynthetic process	cytoplasm	metal ion binding // lyase activity // ferrochelatase activity	hemH	heme <i>b</i> biosynthesis I (aerobic)	WP_011862544.1	WP_011862544.1		PF00762
NAD-dependent epimerase/dehydratase family protein			catalytic activity	P9301_RS13215		WP_011862831.1	WP_011862831.1		PF01370
TIGR00159 family protein	second-messenger-mediated signaling // cAMP biosynthetic process	integral component of membrane // membrane // plasma membrane	nucleotidyltransferase activity // transferase activity // ATP binding // adenylate cyclase activity // nucleotide binding	P9301_RS14795		WP_011863149.1	WP_011863149.1		PF02457
radical SAM/Cys-rich domain protein			iron-sulfur cluster binding // catalytic activity	P9301_RS12345		WP_011862654.1	WP_011862654.1		PF04055
methyltransferase domain-containing protein			methyltransferase activity	P9301_RS15540		WP_011863303.1	WP_011863303.1		PF08241
hypothetical protein				P9301_RS14435		WP_041484695.1	WP_041484695.1		
PDZ domain-containing protein	proteolysis		hydrolase activity // serine-type peptidase activity // peptidase activity	P9301_RS12665		WP_011862718.1	WP_011862718.1		PF17820
hexameric carboxysome shell protein CsoS1A				csoS1A		WP_002807869.1	WP_002807869.1		PF00936
protein translocase subunit SecD	intracellular protein transmembrane transport // protein transport by the Sec complex // protein transport // intracellular protein transport // protein targeting	integral component of membrane // membrane // plasma membrane	P-P-bond-hydrolysis-driven protein transmembrane transporter activity	secD		WP_011862900.1	WP_011862900.1		PF07549
hypothetical protein		integral component of membrane // membrane		P9301_RS16530		WP_011863491.1	WP_011863491.1		
hypothetical protein		integral component of membrane // membrane		P9301_RS11400		WP_011862475.1	WP_011862475.1		
DUF502 domain-containing protein		integral component of membrane // membrane		P9301_RS09135		WP_011862035.1	WP_011862035.1		PF04367
peptidyl-prolyl cis-trans isomerase	protein peptidyl-prolyl isomerization		isomerase activity // peptidyl-prolyl cis-trans isomerase activity	P9301_RS09220		WP_011862052.1	WP_011862052.1		PF00160
global nitrogen regulator NtcA	"regulation of transcription, DNA-templated"		DNA-binding transcription factor activity // DNA binding	ntcA		WP_011862290.1	WP_011862290.1		PF00027
DUF565 domain-containing protein		integral component of membrane // membrane		P9301_RS10325		WP_011862275.1	WP_011862275.1		PF04483
Possible M protein repeat		integral component of membrane // membrane		P9301_RS16550		WP_011863496.1	WP_011863496.1		
kinase	phosphorylation		kinase activity	P9301_RS13390		WP_041484757.1	WP_041484757.1		
rRNA maturation RNase YbeY	"RNA phosphodiester bond hydrolysis, endonucleolytic // nucleic acid phosphodiester bond hydrolysis // ribosome biogenesis // proteolysis // rRNA processing"	cytoplasm	metal ion binding // hydrolase activity // zinc ion binding // endoribonuclease activity // endonuclease activity // nuclease activity // metalloendopeptidase activity	ybeY		WP_011862227.1	WP_011862227.1		PF02130
hypothetical protein				P9301_RS09470		WP_011862105.1	WP_011862105.1		
phosphoserine transaminase				serC	superpathway of L-serine and glycine biosynthesis I // L-serine biosynthesis I	WP_041484737.1	WP_041484737.1		PF00266
uroporphyrinogen-III synthase	tetrapyrrole biosynthetic process // protoporphyrinogen IX biosynthetic process // uroporphyrinogen III biosynthetic process // porphyrin-containing compound biosynthetic process		lyase activity // uroporphyrinogen-III synthase activity	hemD	tetrapyrrole biosynthesis I (from glutamate)	WP_011862156.1	WP_011862156.1		PF02602
diaminopimelate epimerase	lysine biosynthetic process via diaminopimelate // lysine biosynthetic process // cellular amino acid biosynthetic process	cytoplasm	isomerase activity // diaminopimelate epimerase activity	dapF	L-lysine biosynthesis VI	WP_011862942.1	WP_011862942.1		PF01678
cell division protein SepF	cell septum assembly // cell division // FtsZ-dependent cytokinesis // cell cycle // division septum assembly	cytoplasm		sepF		WP_011862420.1	WP_011862420.1		PF04472
cytochrome c biogenesis protein CcsB	cytochrome complex assembly	thylakoid membrane // integral component of membrane // membrane // thylakoid		ccsB		WP_011863571.1	WP_011863571.1		PF05140
NAD(+) kinase	NAD metabolic process // phosphorylation // NADP biosynthetic process	cytoplasm	metal ion binding // transferase activity // kinase activity // ATP binding // NAD+ kinase activity // nucleotide binding	P9301_RS15985	NAD phosphorylation and transhydrogenation	WP_011863386.1	WP_011863386.1		PF01513
DUF296 domain-containing protein	cell redox homeostasis // electron transport chain		protein-disulfide reductase activity // electron transfer activity	P9301_RS13225		WP_011862833.1	WP_011862833.1		PF03479
aspartate-semialdehyde dehydrogenase	'de novo' L-methionine biosynthetic process // diaminopimelate biosynthetic process // isoleucine biosynthetic process // lysine biosynthetic process via diaminopimelate // threonine biosynthetic process // methionine biosynthetic process // lysine biosynthetic process // cellular amino acid biosynthetic process		"NAD binding // NADP binding // protein dimerization activity // oxidoreductase activity, acting on the aldehyde or oxo group of donors, NAD or NADP as acceptor // oxidoreductase activity // aspartate-semialdehyde dehydrogenase activity"	asd	superpathway of L-homoserine and L-methionine biosynthesis // L-lysine biosynthesis VI // L-homoserine biosynthesis // dipicolinate biosynthesis	WP_011863751.1	WP_011863751.1		PF01118
lycopene cyclase family protein	carotenoid biosynthetic process		"oxidoreductase activity, acting on paired donors, with incorporation or reduction of molecular oxygen"	P9301_RS12320		WP_011862649.1	WP_011862649.1		PF05834
peptide chain release factor N(5)-glutamine methyltransferase	methylation // protein methylation		protein-(glutamine-N5) methyltransferase activity // transferase activity // oxidoreductase activity // protein methyltransferase activity // methyltransferase activity // nucleic acid binding	prmC		WP_011862353.1	WP_011862353.1		PF13847
nucleotide sugar dehydrogenase	polysaccharide biosynthetic process		"NAD binding // oxidoreductase activity, acting on the CH-OH group of donors, NAD or NADP as acceptor // oxidoreductase activity // UDP-glucose 6-dehydrogenase activity"	P9301_RS15695		WP_011863330.1	WP_011863330.1		PF03721
ATP phosphoribosyltransferase	cellular amino acid biosynthetic process // histidine biosynthetic process	cytoplasm	"transferase activity, transferring glycosyl groups // transferase activity // ATP binding // ATP phosphoribosyltransferase activity // nucleotide binding"	hisG	L-histidine biosynthesis	WP_011862576.1	WP_011862576.1		PF01634
YqeG family HAD IIIA-type phosphatase			hydrolase activity	P9301_RS13175		WP_011818295.1	WP_011818295.1		PF13242
pentapeptide repeat-containing protein				P9301_RS14540		WP_011818579.1	WP_011818579.1		PF13599
circularly permuted type 2 ATP-grasp protein				P9301_RS14520		WP_011863099.1	WP_011863099.1		PF14403
23S rRNA (guanosine(2251)-2'-O)-methyltransferase RlmB	methylation // RNA processing // RNA methylation		transferase activity // RNA methyltransferase activity // methyltransferase activity // RNA binding	rlmB		WP_011862881.1	WP_011862881.1		PF08032
GTP-binding protein				P9301_RS11605		WP_011862511.1	WP_011862511.1		PF02492
TrkA family potassium uptake protein	cation transmembrane transport // potassium ion transport // ion transport		cation transmembrane transporter activity	P9301_RS09570		WP_011862125.1	WP_011862125.1		PF02254
DUF3007 family protein		integral component of membrane // membrane		P9301_RS12010		WP_011862587.1	WP_011862587.1		PF11460
TM0106 family RecB-like putative nuclease				P9301_RS10565		WP_011862317.1	WP_011862317.1		PF01930
peptide-methionine (S)-S-oxide reductase MsrA	cellular protein modification process		oxidoreductase activity // peptide-methionine (S)-S-oxide reductase activity	msrA		WP_011863446.1	WP_011863446.1		PF01625
